{
  "$schema": "http://json-schema.org/draft-07/schema#",
  "$id": "https://agentplane.dev/schemas/pr-meta.schema.json",
  "title": "PR artifact meta.json (v1)",
  "type": "object",
  "additionalProperties": true,
  "required": ["schema_version", "task_id", "created_at", "updated_at"],
  "properties": {
    "schema_version": {
      "type": "integer",
      "const": 1
    },
    "task_id": {
      "type": "string",
      "minLength": 1
    },
    "branch": {
      "type": "string",
      "minLength": 1
    },
    "base": {
      "type": "string",
      "minLength": 1
    },
    "pr_number": {
      "type": "integer",
      "minimum": 1
    },
    "pr_url": {
      "type": "string",
      "minLength": 1
    },
    "created_at": {
      "type": "string",
      "format": "date-time"
    },
    "updated_at": {
      "type": "string",
      "format": "date-time"
    },
    "status": {
      "type": "string",
      "enum": ["OPEN", "CLOSED", "MERGED"]
    },
    "merge_strategy": {
      "type": "string",
      "enum": ["squash", "merge", "rebase"]
    },
    "merged_at": {
      "type": "string",
      "format": "date-time"
    },
    "merge_commit": {
      "type": "string",
      "minLength": 1
    },
    "head_sha": {
      "type": "string",
      "minLength": 1
    },
    "last_verified_sha": {
      "type": ["string", "null"],
      "minLength": 7
    },
    "last_verified_at": {
      "type": ["string", "null"],
      "format": "date-time"
    },
    "verify": {
      "type": "object",
      "additionalProperties": true,
      "properties": {
        "status": {
          "type": "string",
          "enum": ["pass", "fail", "skipped"]
        },
        "command": {
          "type": "string"
        }
      }
    }
  }
}
