{
  "branch": "task/202603311332-V2JXFM/unify-doc-conflict-semantics",
  "created_at": "2026-03-31T17:59:18.811Z",
  "last_verified_at": null,
  "last_verified_sha": null,
  "schema_version": 1,
  "task_id": "202603311332-V2JXFM",
  "updated_at": "2026-03-31T17:59:32.442Z",
  "verify": {
    "status": "skipped"
  }
}
