{
  "base": "main",
  "branch": "task/202605141812-S9TBZF/star-gateway-homepage",
  "created_at": "2026-05-14T18:15:40.342Z",
  "head_sha": "18e2ec37825f9cd4d706a8c0d830364f7cfd3cc7",
  "last_verified_at": null,
  "last_verified_sha": null,
  "schema_version": 1,
  "task_id": "202605141812-S9TBZF",
  "updated_at": "2026-05-14T18:15:40.342Z",
  "verify": {
    "status": "skipped"
  }
}
