{
  "base": "main",
  "branch": "task/202605171326-FXRVNW/v063-prerelease-rough-edges",
  "created_at": "2026-05-18T17:41:11.285Z",
  "head_sha": "c89d1c6f3eb812e9db7d320dfe3973f30181973e",
  "last_verified_at": "2026-05-18T18:33:48.117Z",
  "last_verified_sha": "8d5099f549f172d40d934ab4b774b2cd51178a91",
  "pr_number": 3898,
  "pr_url": "https://github.com/basilisk-labs/agentplane/pull/3898",
  "schema_version": 1,
  "status": "OPEN",
  "task_id": "202605171326-FXRVNW",
  "updated_at": "2026-05-18T18:37:29.234Z",
  "verify": {
    "status": "pass"
  }
}
